{
  "schema_version": "1.0",
  "profile_id": "phase49-work-report-15",
  "scenario_id": "hospital-finance-annual-work-report-2025",
  "acceptance_profile": "phase49-work-report-15",
  "created_at": "2026-08-09T00:00:00+08:00",
  "library_id": "window-pptx-reference-work-summary-v1",
  "library_index_sha256": "ed4078111e8010d3b171e74463199a8720b7e0d5ca1814a72ff1616b285c42ab",
  "dominant_style_cluster_id": "reference-work-summary",
  "default_unassigned_connective_id": "connective-clear",
  "governed_policy": "deterministic-authorize-exact",
  "slides": [
    {
      "ordinal": 1,
      "page_id": "59b104d31bf3f44c15d407adefe51425c9dcd8bb5c5d1e2212fb38753dc72839:001",
      "narrative_role": "cover",
      "fact_ids": [
        "report-title",
        "department-name",
        "presenter-name",
        "presentation-date",
        "report-year",
        "fragment-s01-cover-hero"
      ],
      "title_binding": {
        "kind": "fact",
        "renderings": [
          {
            "fact_id": "report-title",
            "rendering_sha256": "ef780616837ea941ee1a6475434a87355f006a475f85a9405e914ebb9717deb6"
          }
        ],
        "separator": ""
      },
      "headline_binding": {
        "kind": "fact",
        "renderings": [
          {
            "fact_id": "department-name",
            "rendering_sha256": "24c3c91b231e3d2f2d164798549b885b521e010ef76304b2e855606495e3dd04"
          }
        ],
        "separator": ""
      },
      "query": {
        "role": "cover",
        "capacity_budget": 82,
        "semantic_categories": [
          "封面模板"
        ],
        "asset_requirements": [],
        "customer_assets_available": false,
        "style_cluster": "reference-work-summary",
        "limit": 6,
        "allow_fallback": false,
        "required_source_ordinal": 1
      },
      "bindings": {
        "shape_26": {
          "kind": "fact",
          "renderings": [
            {
              "fact_id": "report-year",
              "rendering_sha256": "fe3f1f98fb3eba5464204df09b2244dab8c30962e9fccd798868fe974cacd5a8"
            }
          ],
          "separator": ""
        },
        "shape_28": {
          "kind": "fact",
          "renderings": [
            {
              "fact_id": "department-name",
              "rendering_sha256": "24c3c91b231e3d2f2d164798549b885b521e010ef76304b2e855606495e3dd04"
            }
          ],
          "separator": ""
        },
        "shape_29": {
          "kind": "fact",
          "renderings": [
            {
              "fact_id": "report-title",
              "rendering_sha256": "3178611d1f1f25242b330b0f3cf2471cdcaea8fe0fda8b4fff5711afad05ebd9"
            }
          ],
          "separator": ""
        },
        "shape_4": {
          "kind": "fact",
          "renderings": [
            {
              "fact_id": "presenter-name",
              "rendering_sha256": "9094498f89e5e86880f1727ca770f4ebb71c8fd2390f645e65051a0ee6354bc9"
            }
          ],
          "separator": ""
        },
        "shape_19": {
          "kind": "fact",
          "renderings": [
            {
              "fact_id": "presentation-date",
              "rendering_sha256": "076bcd286be9d30b1d4af497ae51793bb553f7a300ac1b5bdaa701f746515c89"
            }
          ],
          "separator": ""
        }
      },
      "fragment_bindings": [
        {
          "target_kind": "group",
          "target_id": "fragment_01",
          "fact_id": "fragment-s01-cover-hero",
          "rendering_sha256": "0a98bd475f9ac17bd8c31e5266228de1fd09a11bba9d40dd5236783c52d6f3e1"
        },
        {
          "target_kind": "group",
          "target_id": "fragment_02",
          "fact_id": "fragment-s01-cover-hero",
          "rendering_sha256": "fb31425b6320a6ca31a45363659c1c4dd26d9496d47d3572b546dccf2c79ba96"
        },
        {
          "target_kind": "group",
          "target_id": "fragment_03",
          "fact_id": "fragment-s01-cover-hero",
          "rendering_sha256": "82a0fb11bb116b08dc12aebd75893b3b209625587d50ba9c27597e137a825870"
        }
      ]
    },
    {
      "ordinal": 2,
      "page_id": "59b104d31bf3f44c15d407adefe51425c9dcd8bb5c5d1e2212fb38753dc72839:002",
      "narrative_role": "contents",
      "fact_ids": [
        "contents-governance",
        "contents-finance",
        "contents-innovation",
        "contents-roadmap",
        "fragment-s02-directory"
      ],
      "title_binding": {
        "kind": "fact",
        "renderings": [
          {
            "fact_id": "fragment-s02-directory",
            "rendering_sha256": "52daa71ebc31058156b21dc21c01ed18eb4e9a723749259cacd1558afe32dfea"
          }
        ],
        "separator": ""
      },
      "headline_binding": {
        "kind": "fact",
        "renderings": [
          {
            "fact_id": "contents-governance",
            "rendering_sha256": "1807ec4d1c45618f036f3a306726a90e3b2016328ed72c98661d4bcffe430179"
          },
          {
            "fact_id": "contents-finance",
            "rendering_sha256": "a68e3d611bbbf8bf16d3fecda95386497436fb3558f872c611dc662eb176fc7a"
          },
          {
            "fact_id": "contents-innovation",
            "rendering_sha256": "72153c8051de7c0d4bf4d78cf7fb398fb69f50b8143e161b83d94dcd75a0261c"
          },
          {
            "fact_id": "contents-roadmap",
            "rendering_sha256": "16999f39a2fc1501de7e8401ecf44fafd079668141c406bb851079b391b0ab50"
          }
        ],
        "separator": "\n"
      },
      "query": {
        "role": "contents",
        "capacity_budget": 153,
        "semantic_categories": [
          "目录模板"
        ],
        "asset_requirements": [],
        "customer_assets_available": false,
        "style_cluster": "reference-work-summary",
        "limit": 6,
        "allow_fallback": false,
        "required_source_ordinal": 2
      },
      "bindings": {
        "shape_23": {
          "kind": "connective",
          "connective_id": "contents-en"
        },
        "shape_8": {
          "kind": "fact",
          "renderings": [
            {
              "fact_id": "contents-governance",
              "rendering_sha256": "938db8c9f82c8cb58d3f3ef4fd250036a48d26a712753d2fde5abd03a85cabf4"
            }
          ],
          "separator": ""
        },
        "shape_20": {
          "kind": "fact",
          "renderings": [
            {
              "fact_id": "contents-governance",
              "rendering_sha256": "1807ec4d1c45618f036f3a306726a90e3b2016328ed72c98661d4bcffe430179"
            }
          ],
          "separator": ""
        },
        "shape_15": {
          "kind": "fact",
          "renderings": [
            {
              "fact_id": "contents-finance",
              "rendering_sha256": "a953f09a1b6b6725b81956e9ad0b1eb49e3ad40004c04307ef8af6246a054116"
            }
          ],
          "separator": ""
        },
        "shape_14": {
          "kind": "fact",
          "renderings": [
            {
              "fact_id": "contents-finance",
              "rendering_sha256": "a68e3d611bbbf8bf16d3fecda95386497436fb3558f872c611dc662eb176fc7a"
            }
          ],
          "separator": ""
        },
        "shape_17": {
          "kind": "fact",
          "renderings": [
            {
              "fact_id": "contents-innovation",
              "rendering_sha256": "0b8efa5a3bf104413a725c6ff0459a6be12b1fd33314cbb138745baf39504ae5"
            }
          ],
          "separator": ""
        },
        "shape_16": {
          "kind": "fact",
          "renderings": [
            {
              "fact_id": "contents-innovation",
              "rendering_sha256": "72153c8051de7c0d4bf4d78cf7fb398fb69f50b8143e161b83d94dcd75a0261c"
            }
          ],
          "separator": ""
        },
        "shape_19": {
          "kind": "fact",
          "renderings": [
            {
              "fact_id": "contents-roadmap",
              "rendering_sha256": "6cd5b6e51936a442b973660c21553dd22bd72ddc8751132a943475288113b4c0"
            }
          ],
          "separator": ""
        },
        "shape_18": {
          "kind": "fact",
          "renderings": [
            {
              "fact_id": "contents-roadmap",
              "rendering_sha256": "16999f39a2fc1501de7e8401ecf44fafd079668141c406bb851079b391b0ab50"
            }
          ],
          "separator": ""
        },
        "shape_29": {
          "kind": "connective",
          "connective_id": "contents-en"
        }
      },
      "fragment_bindings": [
        {
          "target_kind": "slot",
          "target_id": "shape_21",
          "fact_id": "fragment-s02-directory",
          "rendering_sha256": "67220858d7f44bbc1242dd89a6bc4520bb072bc8b8b4a33a4281d561ccf1e9da"
        },
        {
          "target_kind": "slot",
          "target_id": "shape_22",
          "fact_id": "fragment-s02-directory",
          "rendering_sha256": "fc72a4479732661f0e5a2f516bbcaba2a3669cd097c9b4e58a65062d505194d4"
        }
      ]
    },
    {
      "ordinal": 3,
      "page_id": "59b104d31bf3f44c15d407adefe51425c9dcd8bb5c5d1e2212fb38753dc72839:003",
      "narrative_role": "section-governance",
      "fact_ids": [
        "governance-section",
        "governance-section-subtitle",
        "fragment-s03-governance-hero"
      ],
      "title_binding": {
        "kind": "fact",
        "renderings": [
          {
            "fact_id": "governance-section",
            "rendering_sha256": "c7b09136f349c5d7e515cbdda1fc28908017bbb0c23c6aa565c455971aaaef31"
          }
        ],
        "separator": ""
      },
      "headline_binding": {
        "kind": "fact",
        "renderings": [
          {
            "fact_id": "governance-section-subtitle",
            "rendering_sha256": "9a72380c6d412efbd0da61cc76e739d282b00d27a4a5fed4ab8fb0020ce9bc6b"
          }
        ],
        "separator": ""
      },
      "query": {
        "role": "section",
        "capacity_budget": 53,